id	title	description	link	image_link	price	availability	condition	google_product_category	brand
4516611905	Black Woman Curly Hair Wall Art | Afrocentric Folk Art Portrait | Digital Download Printable Print	A serene Black woman gazes softly to the side, her voluminous dark curls framing her face against a dreamy backdrop of pink and rose floral brushstrokes. Her cheerful yellow-and-navy speckled dress adds warmth and movement to this painterly folk-art portrait, radiating calm confidence and quiet joy. Perfect for the woman who wants art that looks like her, this piece brings color and soul to a living room, bedroom, home office, or salon. A heartfelt gift for a daughter, sister, or best friend who loves natural-hair beauty and warm, expressive decor. WHAT YOU GET • 1 high-resolution JPG (3840×4800 px, 300 DPI — prints up to 24×36 in) • 1 print-ready PDF • Instant digital download — no physical item shipped Print at home or at Walgreens, Shutterfly, CVS, or your local print shop. High-resolution files support sharp, gallery-quality color and detail up to 24×36 inches. Files are available to download immediately after purchase.	https://brandonstewart88.github.io/p/4516611905.html	https://i.etsystatic.com/57004917/r/il/6bc300/8146853173/il_fullxfull.8146853173_nznb.jpg	5.99 USD	in stock	new	Home & Garden > Decor > Artwork > Posters, Prints, & Visual Artwork	Stewart Digital Prints
4516611795	Black Woman Salon Wall Art | Elegant Beauty Print | Digital Download	An elegant portrait of a poised Black woman seated at a beauty salon, dressed in a crisp white top and flowing navy skirt with pink heels, resting against a counter lined with bottles atop a checkered floor. Coral, teal, and pink strokes give the scene a chic, fashion-forward glamour. Made for salon owners, beauty entrepreneurs, and lovers of stylish Black womanhood. Stunning in a hair studio, beauty bar, dressing room, or chic living space, and a polished gift for the stylist or fashionista in your life. WHAT YOU GET • 1 high-resolution JPG (3840×4800 px, 300 DPI — prints up to 24×36 in) • 1 print-ready PDF • Instant digital download — no physical item shipped Print at home or at Walgreens, Shutterfly, CVS, or your local print shop. High-resolution files support sharp, gallery-quality color and detail up to 24×36 inches. Files are available to download immediately after purchase.	https://brandonstewart88.github.io/p/4516611795.html	https://i.etsystatic.com/57004917/r/il/1ff617/8098949080/il_fullxfull.8098949080_lq0w.jpg	5.99 USD	in stock	new	Home & Garden > Decor > Artwork > Posters, Prints, & Visual Artwork	Stewart Digital Prints
4516611681	Black Garden Harvest Wall Art | Impressionist Print | Digital Download	A lush, impressionistic painting of two figures harvesting in a sun-dappled garden, gathering ripe fruit beneath a laden tree amid swirling greens, blues, and pops of orange bloom. Textured brushwork gives the whole scene a peaceful, almost dreamlike abundance. Perfect for nature lovers and anyone craving a calming, verdant escape on their wall. Beautiful in living rooms, kitchens, sunrooms, and offices, and a lovely gift for gardeners and lovers of soulful landscape art. WHAT YOU GET • 1 high-resolution JPG (3840×4800 px, 300 DPI — prints up to 24×36 in) • 1 print-ready PDF • Instant digital download — no physical item shipped Print at home or at Walgreens, Shutterfly, CVS, or your local print shop. High-resolution files support sharp, gallery-quality color and detail up to 24×36 inches. Files are available to download immediately after purchase.	https://brandonstewart88.github.io/p/4516611681.html	https://i.etsystatic.com/57004917/r/il/f9ade3/8146852979/il_fullxfull.8146852979_106e.jpg	5.99 USD	in stock	new	Home & Garden > Decor > Artwork > Posters, Prints, & Visual Artwork	Stewart Digital Prints
4516606234	Black Family Planting Tree Wall Art | Pink Folk Print | Digital Download	A vibrant folk scene of a Black family planting a young teal-leafed tree together, parents and children kneeling in the soil with a watering can and a loyal dog at their side, all glowing against a rich pink backdrop. Warm, collaborative, and brimming with the promise of new roots. Great for families who believe in growing something lasting together. Brightens living rooms, kitchens, nurseries, and family hallways, and makes a heartfelt new-home, new-baby, or Mother&#39;s Day gift. WHAT YOU GET • 1 high-resolution JPG (3840×4800 px, 300 DPI — prints up to 24×36 in) • 1 print-ready PDF • Instant digital download — no physical item shipped Print at home or at Walgreens, Shutterfly, CVS, or your local print shop. High-resolution files support sharp, gallery-quality color and detail up to 24×36 inches. Files are available to download immediately after purchase.	https://brandonstewart88.github.io/p/4516606234.html	https://i.etsystatic.com/57004917/r/il/ea1cb5/8146852885/il_fullxfull.8146852885_1526.jpg	5.99 USD	in stock	new	Home & Garden > Decor > Artwork > Posters, Prints, & Visual Artwork	Stewart Digital Prints
4516606000	Black Family Gardening Wall Art | Coral Folk Art Print | Digital Download	A tender, painterly scene of a Black family tending a garden together, a father in an apron pouring from a teal watering can while children kneel in the soil and a sun-hatted figure gathers blooms, all set against a glowing coral sky. Earthy, nurturing, and full of quiet devotion. Ideal for families who treasure time spent growing things side by side. Suits living rooms, kitchens, sunrooms, and reading nooks, and makes a heartfelt Mother&#39;s Day, Father&#39;s Day, or housewarming gift. WHAT YOU GET • 1 high-resolution JPG (3840×4800 px, 300 DPI — prints up to 24×36 in) • 1 print-ready PDF • Instant digital download — no physical item shipped Print at home or at Walgreens, Shutterfly, CVS, or your local print shop. High-resolution files support sharp, gallery-quality color and detail up to 24×36 inches. Files are available to download immediately after purchase.	https://brandonstewart88.github.io/p/4516606000.html	https://i.etsystatic.com/57004917/r/il/29c207/8146852713/il_fullxfull.8146852713_snhu.jpg	5.99 USD	in stock	new	Home & Garden > Decor > Artwork > Posters, Prints, & Visual Artwork	Stewart Digital Prints
4516605882	Black Family Garden Wall Art | Colorful Folk Art Print | Digital Download	A joyful, color-saturated folk painting of a Black family standing together in a blooming garden, a father in lemon-yellow, two children in pink and orange, a watering can in hand, and potted sunflowers at their feet against a bright sky-blue and pink horizon. Warm, hopeful, and full of life. A wonderful fit for family rooms, nurseries, and kitchens that need a burst of color and togetherness. A meaningful housewarming, Mother&#39;s Day, or new-baby gift for families who grow love together. WHAT YOU GET • 1 high-resolution JPG (3840×4800 px, 300 DPI — prints up to 24×36 in) • 1 print-ready PDF • Instant digital download — no physical item shipped Print at home or at Walgreens, Shutterfly, CVS, or your local print shop. High-resolution files support sharp, gallery-quality color and detail up to 24×36 inches. Files are available to download immediately after purchase.	https://brandonstewart88.github.io/p/4516605882.html	https://i.etsystatic.com/57004917/r/il/d0fc45/8098948632/il_fullxfull.8098948632_qo7s.jpg	5.99 USD	in stock	new	Home & Garden > Decor > Artwork > Posters, Prints, & Visual Artwork	Stewart Digital Prints
4516605760	Black Beauty Shop Wall Art | Minimalist Salon Print | Digital Download	A serene, minimalist scene of a Black woman seated at a sunlit beauty shop counter, her natural afro framed by rows of styling products, a pop of yellow desk, an empty salon chair, and soft teal walls against a dreamy peach-pink backdrop. The mood is calm, nostalgic, and quietly powerful. Made for salon owners, hairstylists, and lovers of Black beauty culture. Beautiful in a hair studio, beauty bar, bathroom, or vanity nook, and a thoughtful gift for the stylist or entrepreneur who turns hair into art. WHAT YOU GET • 1 high-resolution JPG (3840×4800 px, 300 DPI — prints up to 24×36 in) • 1 print-ready PDF • Instant digital download — no physical item shipped Print at home or at Walgreens, Shutterfly, CVS, or your local print shop. High-resolution files support sharp, gallery-quality color and detail up to 24×36 inches. Files are available to download immediately after purchase.	https://brandonstewart88.github.io/p/4516605760.html	https://i.etsystatic.com/57004917/r/il/01b119/8146852549/il_fullxfull.8146852549_7l73.jpg	5.99 USD	in stock	new	Home & Garden > Decor > Artwork > Posters, Prints, & Visual Artwork	Stewart Digital Prints
4516610589	Black Couple Portrait Wall Art | Modern Folk Art Print | Digital Download	A striking painterly portrait of a Black couple standing side by side, he in a soft pink shirt and dark jacket, she in a golden top with bold gold earrings and a confident red lip. Rendered in warm coral, peach, and pink washes, the piece radiates quiet intimacy, elegance, and unshakable togetherness. Perfect for couples who want art that celebrates Black love with a modern, gallery-worthy edge. Ideal above a bed, in an entryway, or over a living room sofa, and a heartfelt anniversary, wedding, or housewarming gift for the special pair in your life. WHAT YOU GET • 1 high-resolution JPG (3840×4800 px, 300 DPI — prints up to 24×36 in) • 1 print-ready PDF • Instant digital download — no physical item shipped Print at home or at Walgreens, Shutterfly, CVS, or your local print shop. High-resolution files support sharp, gallery-quality color and detail up to 24×36 inches. Files are available to download immediately after purchase.	https://brandonstewart88.github.io/p/4516610589.html	https://i.etsystatic.com/57004917/r/il/a161b2/8146852433/il_fullxfull.8146852433_3cdc.jpg	5.99 USD	in stock	new	Home & Garden > Decor > Artwork > Posters, Prints, & Visual Artwork	Stewart Digital Prints
4516605052	Black Community Gathering Wall Art | Afrocentric Digital Download | Abstract Folk Art Print	A crowd of Black figures stands shoulder to shoulder in profile, their silhouettes layered against bold blocks of mustard, sky blue, and warm white. Patterned garments, a woven hat, and rich impasto texture give this abstract folk-art scene a striking, gallery-worthy sense of community and presence. Perfect for a living room, office, or modern gallery wall, this bold textured print makes an artful statement. A great housewarming or just-because gift for collectors and anyone who loves contemporary art celebrating Black community and culture. WHAT YOU GET • 1 high-resolution JPG (3840×4800 px, 300 DPI — prints up to 24×36 in) • 1 print-ready PDF • Instant digital download — no physical item shipped Print at home or at Walgreens, Shutterfly, CVS, or your local print shop. High-resolution files support sharp, gallery-quality color and detail up to 24×36 inches. Files are available to download immediately after purchase.	https://brandonstewart88.github.io/p/4516605052.html	https://i.etsystatic.com/57004917/r/il/f103c5/8098948354/il_fullxfull.8098948354_83xp.jpg	5.99 USD	in stock	new	Home & Garden > Decor > Artwork > Posters, Prints, & Visual Artwork	Stewart Digital Prints
4516610285	Black Athlete Running Wall Art | Afrocentric Digital Download | Abstract Sports Folk Art Print	A powerful Black athlete sprints across the canvas in mid-stride, his silhouette rendered in deep teal against bold abstract blocks of marigold, coral, and sky blue. The painterly motion and warm palette give this modern folk-art piece a sense of speed, strength, and determination. Ideal for a boy&#39;s room, playroom, or active family space, this energetic print inspires young athletes and dreamers. A motivating gift for sports lovers, runners, and anyone who celebrates Black excellence, movement, and ambition. WHAT YOU GET • 1 high-resolution JPG (3840×4800 px, 300 DPI — prints up to 24×36 in) • 1 print-ready PDF • Instant digital download — no physical item shipped Print at home or at Walgreens, Shutterfly, CVS, or your local print shop. High-resolution files support sharp, gallery-quality color and detail up to 24×36 inches. Files are available to download immediately after purchase.	https://brandonstewart88.github.io/p/4516610285.html	https://i.etsystatic.com/57004917/r/il/8223c8/8146851405/il_fullxfull.8146851405_jy9p.jpg	5.99 USD	in stock	new	Home & Garden > Decor > Artwork > Posters, Prints, & Visual Artwork	Stewart Digital Prints
4516604696	Black Family Dinnertime Wall Art | Afrocentric Digital Download | Vibrant Folk Art Kitchen Print	A Black family shares a lively dinner at a table spread with fruit, baskets, and flowers, painted in saturated pinks, emerald greens, and golden yellows. Parents and children sit close in a bright, patterned room, their warm expressions filling this bold, joyful folk-art scene with the energy of home. Perfect for a kitchen, dining room, or breakfast nook, this colorful print brings cheer and life to mealtime spaces. A wonderful housewarming or family gift for anyone who celebrates good food, loud tables, and time spent together. WHAT YOU GET • 1 high-resolution JPG (3840×4800 px, 300 DPI — prints up to 24×36 in) • 1 print-ready PDF • Instant digital download — no physical item shipped Print at home or at Walgreens, Shutterfly, CVS, or your local print shop. High-resolution files support sharp, gallery-quality color and detail up to 24×36 inches. Files are available to download immediately after purchase.	https://brandonstewart88.github.io/p/4516604696.html	https://i.etsystatic.com/57004917/r/il/057914/8098947232/il_fullxfull.8098947232_al78.jpg	5.99 USD	in stock	new	Home & Garden > Decor > Artwork > Posters, Prints, & Visual Artwork	Stewart Digital Prints
4516604570	Black Family Floral Gathering Wall Art | Afrocentric Digital Download | Folk Art Community Print	A crowd of Black family and friends stands close together beneath a glowing coral and teal sunset, their backs to us as they face the horizon. Patterned dresses in pink, orange, and daisy-white bloom across the canvas like a field of flowers in this dreamy, textured folk-art scene of unity. Great for a living room, entryway, or bedroom seeking warmth and calm, this print celebrates community and connection. A heartfelt gift for family reunions, housewarmings, or anyone who loves serene, uplifting art rooted in Black togetherness. WHAT YOU GET • 1 high-resolution JPG (3840×4800 px, 300 DPI — prints up to 24×36 in) • 1 print-ready PDF • Instant digital download — no physical item shipped Print at home or at Walgreens, Shutterfly, CVS, or your local print shop. High-resolution files support sharp, gallery-quality color and detail up to 24×36 inches. Files are available to download immediately after purchase.	https://brandonstewart88.github.io/p/4516604570.html	https://i.etsystatic.com/57004917/r/il/980683/8098947090/il_fullxfull.8098947090_thtv.jpg	5.99 USD	in stock	new	Home & Garden > Decor > Artwork > Posters, Prints, & Visual Artwork	Stewart Digital Prints
4516604480	Black Family Around the Table Wall Art | Afrocentric Digital Download | Folk Art Gathering Print	A loving Black family gathers around a long table set with flowers, painted in soft watercolor washes of coral, marigold, and ocean blue against a blush sky. Figures lean in close, sharing a meal together in a warm, serene scene that radiates connection and belonging. Ideal for a dining room, kitchen, or open family space, this gentle print celebrates the everyday ritual of gathering. A thoughtful housewarming, wedding, or family gift for anyone who treasures togetherness, shared meals, and home. WHAT YOU GET • 1 high-resolution JPG (3840×4800 px, 300 DPI — prints up to 24×36 in) • 1 print-ready PDF • Instant digital download — no physical item shipped Print at home or at Walgreens, Shutterfly, CVS, or your local print shop. High-resolution files support sharp, gallery-quality color and detail up to 24×36 inches. Files are available to download immediately after purchase.	https://brandonstewart88.github.io/p/4516604480.html	https://i.etsystatic.com/57004917/r/il/2181bd/8146851003/il_fullxfull.8146851003_lpos.jpg	5.99 USD	in stock	new	Home & Garden > Decor > Artwork > Posters, Prints, & Visual Artwork	Stewart Digital Prints
4516604374	Women of the Family Wall Art | Afrocentric Digital Download | Black Sisterhood Folk Art Print	A joyful gathering of Black women stands together beneath leafy green trees, dressed in vibrant turbans, head wraps, and patterned dresses in tangerine, teal, violet, and gold. Wildflowers bloom at their feet in this lush, celebratory folk-art scene bursting with color and togetherness. Made for anyone who honors the women who hold a family together, this print uplifts a living room, hallway, or bedroom gallery wall. A meaningful Mother&#39;s Day, birthday, or housewarming gift celebrating sisterhood, matriarchs, and the bonds between generations of Black women. WHAT YOU GET • 1 high-resolution JPG (3840×4800 px, 300 DPI — prints up to 24×36 in) • 1 print-ready PDF • Instant digital download — no physical item shipped Print at home or at Walgreens, Shutterfly, CVS, or your local print shop. High-resolution files support sharp, gallery-quality color and detail up to 24×36 inches. Files are available to download immediately after purchase.	https://brandonstewart88.github.io/p/4516604374.html	https://i.etsystatic.com/57004917/r/il/b3c1c0/8098946892/il_fullxfull.8098946892_e988.jpg	5.99 USD	in stock	new	Home & Garden > Decor > Artwork > Posters, Prints, & Visual Artwork	Stewart Digital Prints
4516609639	Black Couple Tea Time Wall Art | Romantic Afrocentric Folk Art Print | Digital Download	A tender first date unfolds on a sun-warmed patio, a Black couple leaning close over a small cafe table for two. He glows in a marigold jacket, she radiates in a flowing floral dress, framed by a teal door, trailing blossoms, and a peachy rose sky. The mood is intimate, golden, and full of new-love warmth. Perfect for couples, newlyweds, and anyone who loves romantic, story-driven art. It brings soft charm to a bedroom, living room, or cozy reading nook, and makes a heartfelt anniversary, wedding, or Valentine&#39;s gift celebrating Black love. WHAT YOU GET • 1 high-resolution JPG (3840×4800 px, 300 DPI — prints up to 24×36 in) • 1 print-ready PDF • Instant digital download — no physical item shipped Print at home or at Walgreens, Shutterfly, CVS, or your local print shop. High-resolution files support sharp, gallery-quality color and detail up to 24×36 inches. Files are available to download immediately after purchase.	https://brandonstewart88.github.io/p/4516609639.html	https://i.etsystatic.com/57004917/r/il/c9f5b3/8146850869/il_fullxfull.8146850869_ixvt.jpg	5.99 USD	in stock	new	Home & Garden > Decor > Artwork > Posters, Prints, & Visual Artwork	Stewart Digital Prints
4516604186	Black Couple Dinner Date Art | Afrocentric Wall Art | Digital Download Romantic Print	A Black couple leans close over candlelit wine at an elegant restaurant, she in a coral floral dress and he in deep navy blue, framed by flowers and the soft glow of a city dining room. The rich, painterly color and tender closeness make this dinner date a radiant celebration of Black love and romance. Made for couples and anyone who treasures intimate, elegant moments. It elevates a dining room, bedroom, living room, or entryway, and makes a heartfelt gift for an anniversary, engagement, Valentine&#39;s Day, or a partner who loves timeless romantic art. WHAT YOU GET • 1 high-resolution JPG (3840×4800 px, 300 DPI — prints up to 24×36 in) • 1 print-ready PDF • Instant digital download — no physical item shipped Print at home or at Walgreens, Shutterfly, CVS, or your local print shop. High-resolution files support sharp, gallery-quality color and detail up to 24×36 inches. Files are available to download immediately after purchase.	https://brandonstewart88.github.io/p/4516604186.html	https://i.etsystatic.com/57004917/r/il/f2b262/8146850783/il_fullxfull.8146850783_ndwk.jpg	5.99 USD	in stock	new	Home & Garden > Decor > Artwork > Posters, Prints, & Visual Artwork	Stewart Digital Prints
4516604054	Black Couple First Date Art | Afrocentric Wall Art | Digital Download Romantic Print	A Black couple shares coffee at a small bistro table, reaching toward one another against a bold orange wall framed by lush green leaves and a yellow floral dress. The bright, graphic color blocking gives this first-date moment a sunny, intimate warmth that radiates Black love and new romance. Perfect for couples and anyone who celebrates love and connection. It suits a bedroom, living room, dining nook, or entryway, and makes a romantic gift for an anniversary, wedding, Valentine&#39;s Day, or a partner who loves vibrant, expressive art. WHAT YOU GET • 1 high-resolution JPG (3840×4800 px, 300 DPI — prints up to 24×36 in) • 1 print-ready PDF • Instant digital download — no physical item shipped Print at home or at Walgreens, Shutterfly, CVS, or your local print shop. High-resolution files support sharp, gallery-quality color and detail up to 24×36 inches. Files are available to download immediately after purchase.	https://brandonstewart88.github.io/p/4516604054.html	https://i.etsystatic.com/57004917/r/il/492b24/8146850713/il_fullxfull.8146850713_97ok.jpg	5.99 USD	in stock	new	Home & Garden > Decor > Artwork > Posters, Prints, & Visual Artwork	Stewart Digital Prints
4516609277	Coastal Beach Town Wall Art | Afrocentric Seaside Folk Art Print | Digital Download	A lively seaside town comes alive with sunbathers, palm trees, and colorful umbrellas scattered along a sandy shore while sailboats drift across a sparkling turquoise bay. The textured, impressionistic brushwork gives this beach scene a breezy, sun-soaked energy full of summer movement and warmth. Ideal for beach lovers and anyone craving coastal calm at home. It brightens a living room, bedroom, bathroom, or sunroom, and makes a cheerful gift for travelers, vacation-home owners, or friends who feel most at peace by the sea. WHAT YOU GET • 1 high-resolution JPG (3840×4800 px, 300 DPI — prints up to 24×36 in) • 1 print-ready PDF • Instant digital download — no physical item shipped Print at home or at Walgreens, Shutterfly, CVS, or your local print shop. High-resolution files support sharp, gallery-quality color and detail up to 24×36 inches. Files are available to download immediately after purchase.	https://brandonstewart88.github.io/p/4516609277.html	https://i.etsystatic.com/57004917/r/il/edce83/8146850619/il_fullxfull.8146850619_49ru.jpg	5.99 USD	in stock	new	Home & Garden > Decor > Artwork > Posters, Prints, & Visual Artwork	Stewart Digital Prints
4516603842	Black Family Beach Day Wall Art | Afrocentric Folk Art Print | Digital Download	A Black family stands together at the seaside in patterned summer clothes, dad shading them with a striped umbrella as a bright yellow sun rises over the blue water. The naive, hand-painted style and playful color make this beach day feel warm, tender, and full of family love. Great for families who love coastal charm and authentic representation. It suits a living room, bedroom, nursery, or child&#39;s room, and makes a sweet gift for parents, grandparents, or anyone who holds beach-day memories close. WHAT YOU GET • 1 high-resolution JPG (3840×4800 px, 300 DPI — prints up to 24×36 in) • 1 print-ready PDF • Instant digital download — no physical item shipped Print at home or at Walgreens, Shutterfly, CVS, or your local print shop. High-resolution files support sharp, gallery-quality color and detail up to 24×36 inches. Files are available to download immediately after purchase.	https://brandonstewart88.github.io/p/4516603842.html	https://i.etsystatic.com/57004917/r/il/26627b/8146850529/il_fullxfull.8146850529_khde.jpg	5.99 USD	in stock	new	Home & Garden > Decor > Artwork > Posters, Prints, & Visual Artwork	Stewart Digital Prints
4516603734	Black Family Under Tree Art | Afrocentric Wall Art | Digital Download Colorful Gathering Print	A vibrant willow showers cascading color over a group of Black figures gathered beside a turquoise pool of water. Bursts of pink, gold, and teal turn this contemporary folk-art scene into a celebration of community, shade, and shared moments under a tree of life. Perfect for art lovers who want bold color and rich representation. It brings life to a living room, bedroom, office, or entryway, and makes a striking gift for family, friends, or anyone drawn to joyful, expressive Black art. WHAT YOU GET • 1 high-resolution JPG (3840×4800 px, 300 DPI — prints up to 24×36 in) • 1 print-ready PDF • Instant digital download — no physical item shipped Print at home or at Walgreens, Shutterfly, CVS, or your local print shop. High-resolution files support sharp, gallery-quality color and detail up to 24×36 inches. Files are available to download immediately after purchase.	https://brandonstewart88.github.io/p/4516603734.html	https://i.etsystatic.com/57004917/r/il/1a92ea/8146850433/il_fullxfull.8146850433_c2jn.jpg	5.99 USD	in stock	new	Home & Garden > Decor > Artwork > Posters, Prints, & Visual Artwork	Stewart Digital Prints
