id	title	description	link	image_link	price	availability	condition	google_product_category	brand
4516603608	Black Family Picnic Art | Afrocentric Wall Art | Digital Download Sunset Gathering Print	A circle of Black friends and family share a picnic beneath a glowing pink-and-teal sunset, dishes spread across a blanket as rolling hills fade into dusk. The loose, painterly brushwork and warm coral sky give this gathering a dreamy, communal mood rooted in love, food, and good company. Made for anyone who cherishes community and slow, joyful moments. It warms a dining room, kitchen, living room, or entryway, and makes a beautiful gift for family gatherings, housewarmings, or friends who fill the table with laughter. WHAT YOU GET • 1 high-resolution JPG (3840×4800 px, 300 DPI — prints up to 24×36 in) • 1 print-ready PDF • Instant digital download — no physical item shipped Print at home or at Walgreens, Shutterfly, CVS, or your local print shop. High-resolution files support sharp, gallery-quality color and detail up to 24×36 inches. Files are available to download immediately after purchase.	https://brandonstewart88.github.io/p/4516603608.html	https://i.etsystatic.com/57004917/r/il/913d46/8146850343/il_fullxfull.8146850343_dunu.jpg	5.99 USD	in stock	new	Home & Garden > Decor > Artwork > Posters, Prints, & Visual Artwork	Stewart Digital Prints
4516608735	Black Family Beach Art | Afrocentric Wall Art | Digital Download Printable Coastal Print	A Black family gathers at the shoreline, parents holding hands with their little ones as colorful umbrellas, a soft pink sky, and a mosaic-blue sea fill the scene. The tiled, painterly texture gives this gathering a peaceful, nostalgic warmth that captures togetherness and a perfect day by the water. Ideal for families who love coastal calm and meaningful representation. It suits a living room, bedroom, hallway, or child&#39;s room, and makes a heartfelt gift for parents, new families, or anyone who treasures memories made at the beach. WHAT YOU GET • 1 high-resolution JPG (3840×4800 px, 300 DPI — prints up to 24×36 in) • 1 print-ready PDF • Instant digital download — no physical item shipped Print at home or at Walgreens, Shutterfly, CVS, or your local print shop. High-resolution files support sharp, gallery-quality color and detail up to 24×36 inches. Files are available to download immediately after purchase.	https://brandonstewart88.github.io/p/4516608735.html	https://i.etsystatic.com/57004917/r/il/62426d/8146850213/il_fullxfull.8146850213_i7vz.jpg	5.99 USD	in stock	new	Home & Garden > Decor > Artwork > Posters, Prints, & Visual Artwork	Stewart Digital Prints
4516608575	Black Tennis Women Wall Art | Retro Sports Print | Digital Download	Two confident Black women stand side by side in golden-amber light, tennis rackets in hand and a bright coral sun glowing behind them. The warm ochre and teal palette gives this folk-art piece a vintage, sunlit calm that celebrates style, sisterhood, and the love of the game. Perfect for tennis lovers, athletes, and anyone who admires bold Black femininity. It brings energy to a living room, home office, gym corner, or game room, and makes a thoughtful gift for a sister, friend, or sports fan who wants art that looks like them. WHAT YOU GET • 1 high-resolution JPG (3840×4800 px, 300 DPI — prints up to 24×36 in) • 1 print-ready PDF • Instant digital download — no physical item shipped Print at home or at Walgreens, Shutterfly, CVS, or your local print shop. High-resolution files support sharp, gallery-quality color and detail up to 24×36 inches. Files are available to download immediately after purchase.	https://brandonstewart88.github.io/p/4516608575.html	https://i.etsystatic.com/57004917/r/il/4625a2/8146850093/il_fullxfull.8146850093_ihl2.jpg	5.99 USD	in stock	new	Home & Garden > Decor > Artwork > Posters, Prints, & Visual Artwork	Stewart Digital Prints
4516603098	Black Woman Picnic Wall Art | Retro Collage Style Portrait Print | Digital Download	A serene woman sits with a wicker picnic basket against a vivid teal background, her floral jacket and soft trousers glowing in a pop-art collage style. Scattered butterflies and a striped picnic blanket add a touch of whimsy, while her thoughtful gaze gives the portrait calm, soulful presence. Bold and graphic, this print makes a statement in a living room, bedroom, studio, or entryway. A striking gift for lovers of retro collage art, vibrant color, and confident, beautiful Black portraiture. WHAT YOU GET • 1 high-resolution JPG (3840×4800 px, 300 DPI — prints up to 24×36 in) • 1 print-ready PDF • Instant digital download — no physical item shipped Print at home or at Walgreens, Shutterfly, CVS, or your local print shop. High-resolution files support sharp, gallery-quality color and detail up to 24×36 inches. Files are available to download immediately after purchase.	https://brandonstewart88.github.io/p/4516603098.html	https://i.etsystatic.com/57004917/r/il/a6f880/8146849991/il_fullxfull.8146849991_lold.jpg	5.99 USD	in stock	new	Home & Garden > Decor > Artwork > Posters, Prints, & Visual Artwork	Stewart Digital Prints
4516602740	Black Woman Record Store Wall Art | Pink Vinyl Browsing Print | Digital Download	Seen from behind, a woman in a coral blouse and floral skirt browses a glowing wall of records at a pink-counter shop, lost in the calm ritual of flipping through vinyl. The soft light, saturated color, and quiet posture give the scene a dreamy, unhurried mood. This stylish print brings personality to a living room, music room, home office, or entryway. A lovely gift for the record collector, the music devotee, or anyone drawn to warm, fashionable Black art. WHAT YOU GET • 1 high-resolution JPG (3840×4800 px, 300 DPI — prints up to 24×36 in) • 1 print-ready PDF • Instant digital download — no physical item shipped Print at home or at Walgreens, Shutterfly, CVS, or your local print shop. High-resolution files support sharp, gallery-quality color and detail up to 24×36 inches. Files are available to download immediately after purchase.	https://brandonstewart88.github.io/p/4516602740.html	https://i.etsystatic.com/57004917/r/il/dca257/8098945830/il_fullxfull.8098945830_fqgc.jpg	5.99 USD	in stock	new	Home & Garden > Decor > Artwork > Posters, Prints, & Visual Artwork	Stewart Digital Prints
4516607911	Black Woman Record Shop Wall Art | Yellow Skirt Vinyl Lover Print | Digital Download	A poised woman in a flowing chartreuse skirt browses the bins of a moody blue record shop, a sleeve in hand as she searches for the perfect album. The electric contrast of yellow against deep teal makes this painterly scene feel cool, confident, and effortlessly chic. Ideal for music lovers and lovers of bold color, this print stands out in a living room, home office, studio, or music room. A standout gift for the vinyl collector or the stylish woman with great taste. WHAT YOU GET • 1 high-resolution JPG (3840×4800 px, 300 DPI — prints up to 24×36 in) • 1 print-ready PDF • Instant digital download — no physical item shipped Print at home or at Walgreens, Shutterfly, CVS, or your local print shop. High-resolution files support sharp, gallery-quality color and detail up to 24×36 inches. Files are available to download immediately after purchase.	https://brandonstewart88.github.io/p/4516607911.html	https://i.etsystatic.com/57004917/r/il/344bd7/8146849695/il_fullxfull.8146849695_1ktj.jpg	5.99 USD	in stock	new	Home & Garden > Decor > Artwork > Posters, Prints, & Visual Artwork	Stewart Digital Prints
4516602368	Black Women Community Folk Art | Afrocentric Gathering Wall Art Print | Digital Download	A joyful crowd of figures in red, blue, green, and pink gathers beneath a soft watercolor sky, with two women at the heart of the scene sharing a tender exchange. The simple, painterly shapes and warm palette celebrate sisterhood, community, and the quiet strength of coming together. This uplifting folk-art piece suits a bedroom, living room, or peaceful reading corner. It&#39;s a meaningful gift for a friend, sister, or anyone who treasures Black womanhood and the bonds of community. WHAT YOU GET • 1 high-resolution JPG (3840×4800 px, 300 DPI — prints up to 24×36 in) • 1 print-ready PDF • Instant digital download — no physical item shipped Print at home or at Walgreens, Shutterfly, CVS, or your local print shop. High-resolution files support sharp, gallery-quality color and detail up to 24×36 inches. Files are available to download immediately after purchase.	https://brandonstewart88.github.io/p/4516602368.html	https://i.etsystatic.com/57004917/r/il/d3f427/8098945682/il_fullxfull.8098945682_8pob.jpg	5.99 USD	in stock	new	Home & Garden > Decor > Artwork > Posters, Prints, & Visual Artwork	Stewart Digital Prints
4516607509	Black Couple Record Shop Wall Art | Retro Vinyl Crate Digging Print | Digital Download	A couple leans in close while crate-digging at a vibrant record shop, the wall behind them striped in bold blocks of pink, teal, and gold above rows of vinyl. Her flowing red skirt and his plaid shirt give the scene a flirty, easy warmth, like a perfect afternoon date. This bright, graphic print is made for music lovers and record collectors, lighting up a living room, home studio, or entertainment space. A fun anniversary or housewarming gift for the couple who bonds over good music. WHAT YOU GET • 1 high-resolution JPG (3840×4800 px, 300 DPI — prints up to 24×36 in) • 1 print-ready PDF • Instant digital download — no physical item shipped Print at home or at Walgreens, Shutterfly, CVS, or your local print shop. High-resolution files support sharp, gallery-quality color and detail up to 24×36 inches. Files are available to download immediately after purchase.	https://brandonstewart88.github.io/p/4516607509.html	https://i.etsystatic.com/57004917/r/il/3a8184/8146849539/il_fullxfull.8146849539_fh9z.jpg	5.99 USD	in stock	new	Home & Garden > Decor > Artwork > Posters, Prints, & Visual Artwork	Stewart Digital Prints
4516607321	Black Couple Vinyl Records Wall Art | Retro Music Lover Print Teal | Digital Download	A stylish retro couple shares a quiet moment over a vinyl record player, set against a bold teal backdrop. His mint suit and her sunny orange dress pop with mid-century cool, while the spinning record at the center hums with nostalgia and romance. A dream for music lovers and vinyl collectors, this print energizes a living room, home bar, studio, or music nook. It makes a charming anniversary, wedding, or Valentine&#39;s gift for the couple who falls in love to a good record. WHAT YOU GET • 1 high-resolution JPG (3840×4800 px, 300 DPI — prints up to 24×36 in) • 1 print-ready PDF • Instant digital download — no physical item shipped Print at home or at Walgreens, Shutterfly, CVS, or your local print shop. High-resolution files support sharp, gallery-quality color and detail up to 24×36 inches. Files are available to download immediately after purchase.	https://brandonstewart88.github.io/p/4516607321.html	https://i.etsystatic.com/57004917/r/il/7f3bbd/8098945528/il_fullxfull.8098945528_6qm8.jpg	5.99 USD	in stock	new	Home & Garden > Decor > Artwork > Posters, Prints, & Visual Artwork	Stewart Digital Prints
4516601890	African American Family Portrait | Black Folk Art Wall Decor | Digital Download	Five family members stand close together in this richly layered portrait, dressed in a glorious patchwork of coral, mustard, teal, and floral pattern. Their calm, dignified gazes and the warm painterly texture turn everyday togetherness into something timeless and proud. Perfect for families who want their walls to reflect Black love and unity, this piece brings warmth to a living room, entryway, or hallway gallery. It makes a heartfelt housewarming, holiday, or family reunion gift that celebrates heritage and belonging. WHAT YOU GET • 1 high-resolution JPG (3840×4800 px, 300 DPI — prints up to 24×36 in) • 1 print-ready PDF • Instant digital download — no physical item shipped Print at home or at Walgreens, Shutterfly, CVS, or your local print shop. High-resolution files support sharp, gallery-quality color and detail up to 24×36 inches. Files are available to download immediately after purchase.	https://brandonstewart88.github.io/p/4516601890.html	https://i.etsystatic.com/57004917/r/il/9de6ae/8098945434/il_fullxfull.8098945434_1zmp.jpg	5.99 USD	in stock	new	Home & Garden > Decor > Artwork > Posters, Prints, & Visual Artwork	Stewart Digital Prints
4516601712	Retro Black Family Wall Art | 70s Afro Portrait Print | Digital Download	Against a rich gold and ivory backdrop, a proud Black family stands together in this striking retro portrait, their afros, sharp suits and patterned dresses rendered in warm collage-like detail. The vintage 70s styling and golden tones radiate dignity, heritage and family pride. A powerful centerpiece for living rooms, hallways and family spaces, this piece suits anyone who treasures legacy and Black history. A deeply meaningful gift for family reunions, Juneteenth or relatives who love bold, soulful art rooted in pride. WHAT YOU GET • 1 high-resolution JPG (3840×4800 px, 300 DPI — prints up to 24×36 in) • 1 print-ready PDF • Instant digital download — no physical item shipped Print at home or at Walgreens, Shutterfly, CVS, or your local print shop. High-resolution files support sharp, gallery-quality color and detail up to 24×36 inches. Files are available to download immediately after purchase.	https://brandonstewart88.github.io/p/4516601712.html	https://i.etsystatic.com/57004917/r/il/de2ed2/8146849285/il_fullxfull.8146849285_5od0.jpg	5.99 USD	in stock	new	Home & Garden > Decor > Artwork > Posters, Prints, & Visual Artwork	Stewart Digital Prints
4516606843	Black Woman Vintage Car Wall Art | Retro 70s Print | Digital Download	A stylish Black woman in a flowing mustard skirt stands beside a teal vintage car, palm trees and a sun-faded sky framing the scene. The retro film-grain color and cool turquoise tones give this piece a confident, nostalgic 70s California mood. Made for lovers of vintage and retro-cool decor, this print elevates bedrooms, living rooms, dorms and chic apartments. A standout gift for birthdays or any woman who loves art celebrating Black beauty, style and effortless independence. WHAT YOU GET • 1 high-resolution JPG (3840×4800 px, 300 DPI — prints up to 24×36 in) • 1 print-ready PDF • Instant digital download — no physical item shipped Print at home or at Walgreens, Shutterfly, CVS, or your local print shop. High-resolution files support sharp, gallery-quality color and detail up to 24×36 inches. Files are available to download immediately after purchase.	https://brandonstewart88.github.io/p/4516606843.html	https://i.etsystatic.com/57004917/r/il/4ae01d/8146849215/il_fullxfull.8146849215_67ob.jpg	5.99 USD	in stock	new	Home & Garden > Decor > Artwork > Posters, Prints, & Visual Artwork	Stewart Digital Prints
4516606709	Black Block Party Wall Art | Community Folk Art Print | Digital Download	A sun-washed crowd of Black neighbors fills the frame, dressed in lilac, blue and turquoise as they mingle beneath bright sky-blue and pink walls. The chalky, textured brushwork and cool palette capture the buzz of a packed outdoor block party in full swing. Ideal for anyone who loves vibrant, community-centered art, this piece livens up living rooms, hallways, studios and social spaces. A spirited gift for housewarmings or art lovers who want walls that celebrate Black togetherness, neighborhood and joy. WHAT YOU GET • 1 high-resolution JPG (3840×4800 px, 300 DPI — prints up to 24×36 in) • 1 print-ready PDF • Instant digital download — no physical item shipped Print at home or at Walgreens, Shutterfly, CVS, or your local print shop. High-resolution files support sharp, gallery-quality color and detail up to 24×36 inches. Files are available to download immediately after purchase.	https://brandonstewart88.github.io/p/4516606709.html	https://i.etsystatic.com/57004917/r/il/b02b9e/8098945210/il_fullxfull.8098945210_gz8q.jpg	5.99 USD	in stock	new	Home & Garden > Decor > Artwork > Posters, Prints, & Visual Artwork	Stewart Digital Prints
4516606591	Tropical Block Party Wall Art | Black Beach Folk Art Print | Digital Download	Beneath a hazy teal sky and swaying palms, a lively block party spills down a pastel boardwalk, with parasols, coral and mint storefronts, and a crowd of Black neighbors gathered in the warm sun. The dusty, painterly color gives it a nostalgic, breezy seaside-summer mood. Perfect for lovers of coastal and retro-summer decor, this print brightens living rooms, beach houses, sunrooms and entryways. A great gift for summer birthdays, housewarmings or anyone who loves art that captures community, sunshine and good times. WHAT YOU GET • 1 high-resolution JPG (3840×4800 px, 300 DPI — prints up to 24×36 in) • 1 print-ready PDF • Instant digital download — no physical item shipped Print at home or at Walgreens, Shutterfly, CVS, or your local print shop. High-resolution files support sharp, gallery-quality color and detail up to 24×36 inches. Files are available to download immediately after purchase.	https://brandonstewart88.github.io/p/4516606591.html	https://i.etsystatic.com/57004917/r/il/4362df/8098945100/il_fullxfull.8098945100_cvun.jpg	5.99 USD	in stock	new	Home & Garden > Decor > Artwork > Posters, Prints, & Visual Artwork	Stewart Digital Prints
4516601130	Black Men Gathering Wall Art | Soft Pastel Folk Art Print | Digital Download	Soft watercolor washes of blue, coral and sage bring together a quiet crowd of Black men amid tropical leaves, their faces calm and dignified. The gentle pastel palette and loose, painterly brushwork give the scene a peaceful, dreamlike mood of brotherhood and presence. A serene choice for bedrooms, nurseries, offices and calm living spaces, this print suits anyone drawn to soft, modern folk art. A thoughtful gift for Father&#39;s Day, graduations or anyone who values understated art celebrating Black men and unity. WHAT YOU GET • 1 high-resolution JPG (3840×4800 px, 300 DPI — prints up to 24×36 in) • 1 print-ready PDF • Instant digital download — no physical item shipped Print at home or at Walgreens, Shutterfly, CVS, or your local print shop. High-resolution files support sharp, gallery-quality color and detail up to 24×36 inches. Files are available to download immediately after purchase.	https://brandonstewart88.github.io/p/4516601130.html	https://i.etsystatic.com/57004917/r/il/773e59/8146848985/il_fullxfull.8146848985_b3ml.jpg	5.99 USD	in stock	new	Home & Garden > Decor > Artwork > Posters, Prints, & Visual Artwork	Stewart Digital Prints
4516600812	Black Community Celebration Wall Art | Colorful Folk Art Print | Digital Download	A joyful sea of Black faces fills this canvas, each figure dressed in bold blues, oranges, greens and pinks against a bright, festive backdrop. The flat folk-art shapes and saturated color make it feel like a neon fiesta, a celebration of community, gathering and unapologetic color. Made for lovers of vibrant, maximalist decor, this print energizes living rooms, studios, hallways and creative spaces. A standout gift for housewarmings or anyone who wants their walls to celebrate Black culture, togetherness and pure good energy. WHAT YOU GET • 1 high-resolution JPG (3840×4800 px, 300 DPI — prints up to 24×36 in) • 1 print-ready PDF • Instant digital download — no physical item shipped Print at home or at Walgreens, Shutterfly, CVS, or your local print shop. High-resolution files support sharp, gallery-quality color and detail up to 24×36 inches. Files are available to download immediately after purchase.	https://brandonstewart88.github.io/p/4516600812.html	https://i.etsystatic.com/57004917/r/il/759c2f/8098944892/il_fullxfull.8098944892_jbhj.jpg	5.99 USD	in stock	new	Home & Garden > Decor > Artwork > Posters, Prints, & Visual Artwork	Stewart Digital Prints
4516600324	Black Couple Elegant Gala Wall Art | Folk Art Celebration Print | Digital Download	A glittering ballroom of Black guests in their finest, jewel-toned gowns and emerald tuxedos catch the light as an elegant couple steps forward at the center. Painted in warm coral, teal and blush tones, the scene hums with glamour, romance and the joy of a grand celebration. Perfect for couples and anyone who loves refined, celebratory art, this piece brings a touch of black-tie elegance to living rooms, bedrooms and entryways. A heartfelt gift for anniversaries, weddings or housewarmings, it honors Black love and the beauty of dressing up together. WHAT YOU GET • 1 high-resolution JPG (3840×4800 px, 300 DPI — prints up to 24×36 in) • 1 print-ready PDF • Instant digital download — no physical item shipped Print at home or at Walgreens, Shutterfly, CVS, or your local print shop. High-resolution files support sharp, gallery-quality color and detail up to 24×36 inches. Files are available to download immediately after purchase.	https://brandonstewart88.github.io/p/4516600324.html	https://i.etsystatic.com/57004917/r/il/98c953/8146848789/il_fullxfull.8146848789_7s0i.jpg	5.99 USD	in stock	new	Home & Garden > Decor > Artwork > Posters, Prints, & Visual Artwork	Stewart Digital Prints
4516468789	Black Community Wall Art | African American Gathering Print | Ernie Barnes Style Digital Download	A dignified gathering of figures stands together — one in a crisp white suit and Panama hat — rendered in bold reds, teals, and creams with rich, textured brushwork. In the spirit of Ernie Barnes, it honors fellowship, heritage, and the quiet power of a community standing as one. Striking in living rooms, dining rooms, offices, and gallery walls. A meaningful gift celebrating Black history, family, and togetherness. WHAT YOU GET • 1 high-resolution JPG (3840×4800 px, 300 DPI — prints up to 24×36 in) • 1 print-ready PDF • Instant digital download — no physical item shipped Print at home or at Walgreens, Shutterfly, CVS, or your local print shop. High-resolution files support sharp, gallery-quality color and detail up to 24×36 inches. Files are available to download immediately after purchase.	https://brandonstewart88.github.io/p/4516468789.html	https://i.etsystatic.com/57004917/r/il/ff7972/8098948248/il_fullxfull.8098948248_jrl9.jpg	5.99 USD	in stock	new	Home & Garden > Decor > Artwork > Posters, Prints, & Visual Artwork	Stewart Digital Prints
4516468679	Colorful Black Art Print | African American Gathering Wall Art | Abstract Digital Download	A joyful, candy-colored crowd in hats — pinks, teals, oranges, and polka dots swirling into a festive congregation. Abstract and celebratory, it turns the everyday gathering into something radiant and full of life. A standout for living rooms, gallery walls, kids&#39; and family spaces, and any room that could use more color and joy. A vibrant gift celebrating Black culture, community, and happiness. WHAT YOU GET • 1 high-resolution JPG (3840×4800 px, 300 DPI — prints up to 24×36 in) • 1 print-ready PDF • Instant digital download — no physical item shipped Print at home or at Walgreens, Shutterfly, CVS, or your local print shop. High-resolution files support sharp, gallery-quality color and detail up to 24×36 inches. Files are available to download immediately after purchase.	https://brandonstewart88.github.io/p/4516468679.html	https://i.etsystatic.com/57004917/r/il/d6040d/8098948124/il_fullxfull.8098948124_ah4x.jpg	5.99 USD	in stock	new	Home & Garden > Decor > Artwork > Posters, Prints, & Visual Artwork	Stewart Digital Prints
4516468599	Black Art Print | African American Figures in Sun Hats | Soft Painterly Digital Download	Three figures in straw sun hats gather in a haze of soft pink and coral — a still, contemplative painting of Sunday-best dignity and quiet community. Warm, atmospheric, and timeless, with the painterly soul of African American folk art. Beautiful in living rooms, bedrooms, entryways, and reading nooks. A heartfelt gift celebrating Black heritage, family, and togetherness. WHAT YOU GET • 1 high-resolution JPG (3840×4800 px, 300 DPI — prints up to 24×36 in) • 1 print-ready PDF • Instant digital download — no physical item shipped Print at home or at Walgreens, Shutterfly, CVS, or your local print shop. High-resolution files support sharp, gallery-quality color and detail up to 24×36 inches. Files are available to download immediately after purchase.	https://brandonstewart88.github.io/p/4516468599.html	https://i.etsystatic.com/57004917/r/il/7a5d27/8098948002/il_fullxfull.8098948002_rmcx.jpg	5.99 USD	in stock	new	Home & Garden > Decor > Artwork > Posters, Prints, & Visual Artwork	Stewart Digital Prints
