id	title	description	link	image_link	price	availability	condition	google_product_category	brand
4495654271	Black Wedding Botanical Art | African American Bride & Groom Print (Digital Download)	A breathtaking folk-art portrait of a Black bride and groom standing side by side, framed by an explosion of coral roses, wildflowers, tropical leaves, and botanical greenery. Her white gown and bouquet. His dark suit and boutonniere. The whole composition feels like walking into a garden that someone planted just for the ceremony. An unforgettable wedding gift, engagement present, bridal shower surprise, or anniversary keepsake. Also works as a statement piece in bedrooms, entryways, or any space that celebrates love and commitment. WHAT YOU GET • 1 high-resolution JPG (print up to 24×36 in) • 1 PNG with transparent-ready background • 1 print-ready PDF (8×10 letter-scaled) • Instant digital download — no shipping Print at home or at Walgreens, Shutterfly, CVS, or your local print shop. High-resolution JPG supports prints up to 24x36 inches with vivid, gallery-quality color and detail. No physical item shipped — instant download available immediately after purchase.	https://brandonstewart88.github.io/p/4495654271.html	https://i.etsystatic.com/57004917/r/il/502b71/7958852228/il_fullxfull.7958852228_lgj6.jpg	5.99 USD	in stock	new	Home & Garden > Decor > Artwork > Posters, Prints, & Visual Artwork	Stewart Digital Prints
4516612103	Black Woman Profile Wall Art | Afrocentric Colorful Portrait | Digital Download Printable Print	Shown in graceful profile, a Black woman with springy dark curls tilts her head against a playful patchwork of pink, teal, and cream checks and arcs. A sunny yellow bodice grounds the composition, giving this portrait a fresh, geometric, modern-folk energy full of life and movement. Ideal for a colorful, eclectic home, this piece pops in a living room, teen room, studio, or creative workspace. A vibrant gift for a friend who loves bold color, artful pattern, and portraits that celebrate Black beauty. WHAT YOU GET • 1 high-resolution JPG (3840×4800 px, 300 DPI — prints up to 24×36 in) • 1 print-ready PDF • Instant digital download — no physical item shipped Print at home or at Walgreens, Shutterfly, CVS, or your local print shop. High-resolution files support sharp, gallery-quality color and detail up to 24×36 inches. Files are available to download immediately after purchase.	https://brandonstewart88.github.io/p/4516612103.html	https://i.etsystatic.com/57004917/r/il/80747e/8146853385/il_fullxfull.8146853385_6ok3.jpg	5.99 USD	in stock	new	Home & Garden > Decor > Artwork > Posters, Prints, & Visual Artwork	Stewart Digital Prints
4495656374	Black Family Garden Art | African American Mother & Child Print (Digital Download)	A tender painterly scene of a Black family tending their garden together — father carrying a bouquet of fresh-cut flowers, mother in a warm orange dress, their young son helping with the watering can. Soft peach and coral tones wash through beds of wildflowers and greenery. The kind of piece that makes a room feel like home. Perfect for living rooms, kitchens, hallways, nurseries, or any space that celebrates family and togetherness. A beautiful Mother&#39;s Day gift, housewarming present, or anniversary surprise for the couple who builds things together — including gardens. WHAT YOU GET • 1 high-resolution JPG (print up to 24×36 in) • 1 PNG with transparent-ready background • 1 print-ready PDF (8×10 letter-scaled) • Instant digital download — no shipping Print at home or at Walgreens, Shutterfly, CVS, or your local print shop. High-resolution JPG supports prints up to 24x36 inches with vivid, gallery-quality color and detail. No physical item shipped — instant download available immed	https://brandonstewart88.github.io/p/4495656374.html	https://i.etsystatic.com/57004917/r/il/3809fc/8006788139/il_fullxfull.8006788139_ngzk.jpg	5.99 USD	in stock	new	Home & Garden > Decor > Artwork > Posters, Prints, & Visual Artwork	Stewart Digital Prints
4516608247	Black Cookout Wall Art | African American Family Gathering Print | Digital Download	Under a canopy of string lights and palm leaves, a lively crowd mingles at an evening cookout, dressed in pinks, blues, and sun-warmed brights. Loose impressionist brushwork captures the buzz of conversation, laughter, and the easy joy of a Black family celebration in full swing. This warm, festive piece brings life to a dining room, kitchen, living room, or gathering space. A perfect gift for cookout hosts, family reunions, or anyone who loves art that feels like home and good company. WHAT YOU GET • 1 high-resolution JPG (3840×4800 px, 300 DPI — prints up to 24×36 in) • 1 print-ready PDF • Instant digital download — no physical item shipped Print at home or at Walgreens, Shutterfly, CVS, or your local print shop. High-resolution files support sharp, gallery-quality color and detail up to 24×36 inches. Files are available to download immediately after purchase.	https://brandonstewart88.github.io/p/4516608247.html	https://i.etsystatic.com/57004917/r/il/0f1905/8098945910/il_fullxfull.8098945910_36py.jpg	5.99 USD	in stock	new	Home & Garden > Decor > Artwork > Posters, Prints, & Visual Artwork	Stewart Digital Prints
4484143815	Black Grandmother Art | African American Generations Print (Digital Download)	Honor the love between generations with this heartwarming art print of a Black grandmother tenderly holding her grandchild. Warm golden yellows, soft blues, and earthy tones create a sun-drenched, painterly scene that radiates unconditional love and wisdom. She wears a beautiful head wrap and flowing dress, embodying the strength, grace, and nurturing spirit that grandmothers bring to every family. This piece is perfect for living rooms, nurseries, bedrooms, or any space where you want to celebrate the bond between generations. It makes a deeply meaningful gift for Mother&#39;s Day, Grandparents&#39; Day, birthdays, or simply to say &quot;thank you&quot; to the matriarch who holds everything together. Print at home or at Walgreens, Shutterfly, CVS, or your local print shop. High-resolution JPG supports prints up to 24x36 inches with rich, gallery-quality color. No physical item shipped — instant download available immediately after purchase.	https://brandonstewart88.github.io/p/4484143815.html	https://i.etsystatic.com/57004917/r/il/d97798/7935504041/il_fullxfull.7935504041_f8v1.jpg	5.99 USD	in stock	new	Home & Garden > Decor > Artwork > Posters, Prints, & Visual Artwork	Stewart Digital Prints
4485426489	Black Grandmother Art | African American Generations Love Print (Digital Download)	Celebrate the unbreakable bond between grandmother and grandchild with this radiant art print set against a stunning pink backdrop. Rich cultural colors — emerald green, warm golds, and vibrant pinks — bring this tender moment to life as a grandmother holds her grandchild close, wrapped in love and tradition. This piece captures the heart of Black family life: the wisdom passed down, the stories shared, and the love that holds generations together. Perfect for living rooms, nurseries, bedrooms, or any wall that deserves a piece full of warmth and meaning. An ideal Mother&#39;s Day gift, Grandparents&#39; Day present, or birthday surprise for the grandmother who means everything. WHAT YOU&#39;LL RECEIVE: - High-resolution digital art file (300 DPI) - Instant download — no shipping, no waiting PRINT SIZES: This digital download can be printed at any size. We recommend 8x10, 11x14, 16x20, or 24x36 for best results. HOW TO USE: 1. Purchase and download your files instantly 2. Print at home	https://brandonstewart88.github.io/p/4485426489.html	https://i.etsystatic.com/57004917/r/il/ff9366/7895645718/il_fullxfull.7895645718_1oap.jpg	5.99 USD	in stock	new	Home & Garden > Decor > Artwork > Posters, Prints, & Visual Artwork	Stewart Digital Prints
4516604980	Black Men Brotherhood Wall Art | Afrocentric Digital Download | Surreal Folk Art Print	Four well-dressed Black men sit together beneath an arched stone pavilion, framed by a dreamlike rose-pink sky with two watchful birds perched above. The bold silhouettes, suits, and surreal architecture give this striking collage-style piece a quiet dignity and timeless sense of brotherhood. Great for an office, study, barbershop, or living room, this sophisticated print honors fellowship, style, and community among Black men. A standout Father&#39;s Day, graduation, or housewarming gift for anyone drawn to bold, conversation-starting art. WHAT YOU GET • 1 high-resolution JPG (3840×4800 px, 300 DPI — prints up to 24×36 in) • 1 print-ready PDF • Instant digital download — no physical item shipped Print at home or at Walgreens, Shutterfly, CVS, or your local print shop. High-resolution files support sharp, gallery-quality color and detail up to 24×36 inches. Files are available to download immediately after purchase.	https://brandonstewart88.github.io/p/4516604980.html	https://i.etsystatic.com/57004917/r/il/5655ce/8146851515/il_fullxfull.8146851515_ta46.jpg	5.99 USD	in stock	new	Home & Garden > Decor > Artwork > Posters, Prints, & Visual Artwork	Stewart Digital Prints
4516606259	Black Family Garden Party Wall Art | Folk Art Cookout Print | Digital Download	Under a soft haze of light, a lush garden gathering unfolds: tables of food, blooming coral and pink flowers, and a warm crowd of Black family and friends mingling in their Sunday best. The painterly detail and rich color give the scene the feeling of a treasured summer cookout caught mid-celebration. Ideal for anyone who cherishes family, food and togetherness, this piece warms dining rooms, kitchens and living spaces. A meaningful gift for family reunions, housewarmings or relatives who love art that celebrates Black joy and gathering. WHAT YOU GET • 1 high-resolution JPG (3840×4800 px, 300 DPI — prints up to 24×36 in) • 1 print-ready PDF • Instant digital download — no physical item shipped Print at home or at Walgreens, Shutterfly, CVS, or your local print shop. High-resolution files support sharp, gallery-quality color and detail up to 24×36 inches. Files are available to download immediately after purchase.	https://brandonstewart88.github.io/p/4516606259.html	https://i.etsystatic.com/57004917/r/il/624d0e/8098944960/il_fullxfull.8098944960_rwg4.jpg	5.99 USD	in stock	new	Home & Garden > Decor > Artwork > Posters, Prints, & Visual Artwork	Stewart Digital Prints
4516611441	Black Family Garden Wall Art | Bold Pink Folk Print | Digital Download	A bold, graphic portrait of a Black family gathered around a flourishing potted plant, a father in a wide-brim hat, a mother in a flowing yellow skirt, and children with a shovel and watering can, all silhouetted against a vivid hot-pink background. Confident, rooted, and unforgettable. A statement piece for anyone who loves art that celebrates family legacy and growth with daring color. Perfect over a sofa, in an entryway, or in a bold gallery wall, and a striking housewarming or family-reunion gift. WHAT YOU GET • 1 high-resolution JPG (3840×4800 px, 300 DPI — prints up to 24×36 in) • 1 print-ready PDF • Instant digital download — no physical item shipped Print at home or at Walgreens, Shutterfly, CVS, or your local print shop. High-resolution files support sharp, gallery-quality color and detail up to 24×36 inches. Files are available to download immediately after purchase.	https://brandonstewart88.github.io/p/4516611441.html	https://i.etsystatic.com/57004917/r/il/7861b8/8098948810/il_fullxfull.8098948810_pbjv.jpg	5.99 USD	in stock	new	Home & Garden > Decor > Artwork > Posters, Prints, & Visual Artwork	Stewart Digital Prints
4478366098	Black Family Dinner Table Art | African American Wall Art Print (Digital Download)	Bring the warmth of a family dinner into your home with this vibrant contemporary art print. A large Black family gathers lovingly around a beautifully set table under a pastel sunset sky, with lush tropical plants framing the scene on both sides. Bold turquoise, golden yellow, orange, and coral tones create an atmosphere of celebration, love, togetherness, and gratitude. This piece captures the essence of Sunday dinners, holiday gatherings, birthday celebrations, and the everyday magic of sharing a meal with the people who matter most. Its expressive, painterly style adds both sophistication and soul to any room in your home. Ideal for dining rooms, kitchens, living rooms, or family gathering spaces. Print at home or use any professional service — Walgreens, Shutterfly, CVS, or your local shop. The high-resolution JPG file supports prints up to 24x36 inches with vivid, gallery-quality color and sharp detail. No physical item shipped — instant download available immediately after purch	https://brandonstewart88.github.io/p/4478366098.html	https://i.etsystatic.com/57004917/r/il/6e50b3/7915384047/il_fullxfull.7915384047_3dgc.jpg	5.99 USD	in stock	new	Home & Garden > Decor > Artwork > Posters, Prints, & Visual Artwork	Stewart Digital Prints
4516614472	Set of 4 Black Love Couple Wall Art | Romantic Afrocentric Bundle | Digital Download	Four tender scenes of Black love — first dates over coffee and wine, tea time on a sunlit patio, and an elegant couple portrait — painted in warm coral, peach, and gold. A romantic gallery-wall set that celebrates connection, courtship, and lasting love. Perfect above a bed, in a living room, or as a wedding or anniversary gift, this bundle brings warmth and romance to any space. Four coordinated prints at one bundle price — a complete love-story gallery wall in one download. WHAT YOU GET — SET OF 4 PRINTS • 4 high-resolution JPG files (each 300 DPI — prints up to 24×36 in) • Instant digital download — no physical item shipped • A coordinated gallery-wall set at a bundle price (save vs. buying singly) Print at home or at Walgreens, Shutterfly, CVS, or your local print shop. Each file supports sharp, gallery-quality prints up to 24×36 inches. Standard sizes (4:5, 8x10, 11x14, 16x20, 24x30) — just choose &#39;fit&#39; when printing. Files download immediately after purchase.	https://brandonstewart88.github.io/p/4516614472.html	https://i.etsystatic.com/57004917/r/il/ec1824/8146768401/il_fullxfull.8146768401_jfa4.jpg	19.99 USD	in stock	new	Home & Garden > Decor > Artwork > Posters, Prints, & Visual Artwork	Stewart Digital Prints
4516614250	Vinyl Record Wall Art Set of 4 | Retro Music Lover Prints | Digital Download	A retro-cool set of four prints set in the record shop — crate-digging, browsing vinyl, and the quiet joy of finding the perfect album, all in bold teal, coral, and gold. A coordinated gallery wall for anyone who lives for music and that warm analog feeling. Perfect for a music room, home bar, studio, or living room, this bundle is a standout gift for vinyl collectors, DJs, and music lovers. Four matching prints at one bundle price — an instant, stylish gallery wall download. WHAT YOU GET — SET OF 4 PRINTS • 4 high-resolution JPG files (each 300 DPI — prints up to 24×36 in) • Instant digital download — no physical item shipped • A coordinated gallery-wall set at a bundle price (save vs. buying singly) Print at home or at Walgreens, Shutterfly, CVS, or your local print shop. Each file supports sharp, gallery-quality prints up to 24×36 inches. Standard sizes (4:5, 8x10, 11x14, 16x20, 24x30) — just choose &#39;fit&#39; when printing. Files download immediately after purchase.	https://brandonstewart88.github.io/p/4516614250.html	https://i.etsystatic.com/57004917/r/il/506770/8098863632/il_fullxfull.8098863632_jhu8.jpg	19.99 USD	in stock	new	Home & Garden > Decor > Artwork > Posters, Prints, & Visual Artwork	Stewart Digital Prints
4516614050	Set of 4 Black Family Garden Wall Art | Afrocentric Gallery Wall Bundle | Digital Download	Four vibrant folk-art scenes of a Black family planting, watering, and growing a garden together — coral skies, lemon-yellow and hot-pink palettes, and the warmth of family rooting something lasting. Made to hang as a set that fills a wall with color, love, and togetherness. Ideal for a living room, kitchen, nursery, or family hallway, this bundle is a heartfelt housewarming, Mother&#39;s Day, or new-home gift. Four coordinated prints at one bundle price — a full gallery wall celebrating family and growth. WHAT YOU GET — SET OF 4 PRINTS • 4 high-resolution JPG files (each 300 DPI — prints up to 24×36 in) • Instant digital download — no physical item shipped • A coordinated gallery-wall set at a bundle price (save vs. buying singly) Print at home or at Walgreens, Shutterfly, CVS, or your local print shop. Each file supports sharp, gallery-quality prints up to 24×36 inches. Standard sizes (4:5, 8x10, 11x14, 16x20, 24x30) — just choose &#39;fit&#39; when printing. Files download immediate	https://brandonstewart88.github.io/p/4516614050.html	https://i.etsystatic.com/57004917/r/il/2402ce/8098862514/il_fullxfull.8098862514_koln.jpg	19.99 USD	in stock	new	Home & Garden > Decor > Artwork > Posters, Prints, & Visual Artwork	Stewart Digital Prints
4516619171	Black Woman Natural Hair Wall Art Set of 4 | Afrocentric Portraits | Digital Download	A coordinated set of four painterly portraits celebrating Black women and natural hair — curls, afros, and crowns rendered in warm florals, bold color, and confident calm. Designed to hang together as a gallery wall that radiates beauty, softness, and self-assured joy. Perfect for a bedroom, salon, boutique, or dressing room, this bundle is a meaningful gift for a daughter, sister, stylist, or best friend. Four cohesive prints at one bundle price — an easy, beautiful gallery wall in a single download. WHAT YOU GET — SET OF 4 PRINTS • 4 high-resolution JPG files (each 300 DPI — prints up to 24×36 in) • Instant digital download — no physical item shipped • A coordinated gallery-wall set at a bundle price (save vs. buying singly) Print at home or at Walgreens, Shutterfly, CVS, or your local print shop. Each file supports sharp, gallery-quality prints up to 24×36 inches. Standard sizes (4:5, 8x10, 11x14, 16x20, 24x30) — just choose &#39;fit&#39; when printing. Files download immediately af	https://brandonstewart88.github.io/p/4516619171.html	https://i.etsystatic.com/57004917/r/il/017f0b/8098861602/il_fullxfull.8098861602_3o7n.jpg	19.99 USD	in stock	new	Home & Garden > Decor > Artwork > Posters, Prints, & Visual Artwork	Stewart Digital Prints
4516609620	Black Woman Afro Wall Art | Afrocentric Botanical Portrait | Digital Download Printable Print	A Black woman with a striking rounded afro turns in profile against a lush garden of greens, pinks, and golden yellows. Her vivid patterned top blends into the leafy botanical brushwork, creating a radiant, jungle-fresh portrait that feels alive with energy and self-assured beauty. Great for plant lovers and color lovers alike, this print brings life to a living room, sunroom, bedroom, or boutique wall. A standout gift for a friend or family member who loves natural hair, bold color, and nature-inspired Black art. WHAT YOU GET • 1 high-resolution JPG (3840×4800 px, 300 DPI — prints up to 24×36 in) • 1 print-ready PDF • Instant digital download — no physical item shipped Print at home or at Walgreens, Shutterfly, CVS, or your local print shop. High-resolution files support sharp, gallery-quality color and detail up to 24×36 inches. Files are available to download immediately after purchase.	https://brandonstewart88.github.io/p/4516609620.html	https://i.etsystatic.com/57004917/r/il/b36f6e/8098949394/il_fullxfull.8098949394_p9on.jpg	5.99 USD	in stock	new	Home & Garden > Decor > Artwork > Posters, Prints, & Visual Artwork	Stewart Digital Prints
4516612439	Surreal Collage Portrait Wall Art | Afrocentric Vintage Pop Art | Digital Download Printable Print	A surreal collage portrait of a Black woman in round glasses and a crisp lace-trimmed blouse, crowned with an ornate doily-like hat, set against a split pink-and-cream pop background. The vintage, dreamlike layering gives this piece an editorial, art-gallery edge full of mystery and elegance. Perfect for the collector with an eclectic eye, it elevates a gallery wall, office, boutique, or chic entryway. A sophisticated gift for lovers of surrealist collage, retro fashion, and bold, culture-forward Black art. WHAT YOU GET • 1 high-resolution JPG (3840×4800 px, 300 DPI — prints up to 24×36 in) • 1 print-ready PDF • Instant digital download — no physical item shipped Print at home or at Walgreens, Shutterfly, CVS, or your local print shop. High-resolution files support sharp, gallery-quality color and detail up to 24×36 inches. Files are available to download immediately after purchase.	https://brandonstewart88.github.io/p/4516612439.html	https://i.etsystatic.com/57004917/r/il/51524c/8098949648/il_fullxfull.8098949648_s48r.jpg	5.99 USD	in stock	new	Home & Garden > Decor > Artwork > Posters, Prints, & Visual Artwork	Stewart Digital Prints
4516612311	Abstract Shapes Wall Art | Bold Modern Pop Art Print | Digital Download Printable	Bold organic shapes collide in this playful abstract composition: a wavy black blob with peeking eyes nestles among a vivid green circle, blue and pink crescents, and a pop of orange, all over crisp white. Hand-drawn line textures add rhythm and quirk to this graphic, contemporary print. A cheerful focal point for a modern home, it shines in a living room, nursery, studio, or creative office. A fun gift for design lovers and anyone who wants playful, color-blocked art with personality. WHAT YOU GET • 1 high-resolution JPG (3840×4800 px, 300 DPI — prints up to 24×36 in) • 1 print-ready PDF • Instant digital download — no physical item shipped Print at home or at Walgreens, Shutterfly, CVS, or your local print shop. High-resolution files support sharp, gallery-quality color and detail up to 24×36 inches. Files are available to download immediately after purchase.	https://brandonstewart88.github.io/p/4516612311.html	https://i.etsystatic.com/57004917/r/il/b14945/8098949558/il_fullxfull.8098949558_gh43.jpg	5.99 USD	in stock	new	Home & Garden > Decor > Artwork > Posters, Prints, & Visual Artwork	Stewart Digital Prints
4516606896	Funky Monster Face Wall Art | Bold Pop Art Polka Dot Print | Digital Download Printable	A wild, googly-eyed monster face grins out from a sea of black-and-white polka dots, its toothy grin glowing with a neon pink-and-purple halo. This bold, playful pop-art print channels hypebeast and street-art energy with cheeky character and high-contrast graphic punch. Built for a fun, fearless space, it makes a statement in a teen room, game room, studio, dorm, or office. A perfect gift for sneakerheads, designers, and anyone who loves quirky, eye-catching maximalist decor. WHAT YOU GET • 1 high-resolution JPG (3840×4800 px, 300 DPI — prints up to 24×36 in) • 1 print-ready PDF • Instant digital download — no physical item shipped Print at home or at Walgreens, Shutterfly, CVS, or your local print shop. High-resolution files support sharp, gallery-quality color and detail up to 24×36 inches. Files are available to download immediately after purchase.	https://brandonstewart88.github.io/p/4516606896.html	https://i.etsystatic.com/57004917/r/il/746f78/8098949490/il_fullxfull.8098949490_lg7o.jpg	5.99 USD	in stock	new	Home & Garden > Decor > Artwork > Posters, Prints, & Visual Artwork	Stewart Digital Prints
4516606702	Black Woman Natural Hair Wall Art | Afrocentric Floral Portrait | Digital Download Printable Print	A poised Black woman with a full, rounded afro looks ahead with quiet strength, draped in a flowing top bursting with bold red, blue, and white folk-art florals. The neutral blush background lets her natural crown and the vivid blooms take center stage in this warm painterly portrait. Made for anyone who celebrates natural hair and botanical color, this print elevates a bedroom, entryway, reading nook, or boutique. A meaningful gift for a mother, friend, or graduate who loves expressive, culture-rich wall art. WHAT YOU GET • 1 high-resolution JPG (3840×4800 px, 300 DPI — prints up to 24×36 in) • 1 print-ready PDF • Instant digital download — no physical item shipped Print at home or at Walgreens, Shutterfly, CVS, or your local print shop. High-resolution files support sharp, gallery-quality color and detail up to 24×36 inches. Files are available to download immediately after purchase.	https://brandonstewart88.github.io/p/4516606702.html	https://i.etsystatic.com/57004917/r/il/718166/8146853301/il_fullxfull.8146853301_gqps.jpg	5.99 USD	in stock	new	Home & Garden > Decor > Artwork > Posters, Prints, & Visual Artwork	Stewart Digital Prints
