id	title	description	link	image_link	price	availability	condition	google_product_category	brand
1845235496	Pink Strawberry Inspirational Digital Print | Retro Botanical Art with Motivational Quote | Digital Download	Celebrate the beauty of growth and purpose with this Pink Strawberry Inspirational Digital Print. Featuring a retro-inspired illustration of a strawberry in soft pink tones, this artwork is paired with an uplifting quote: “Every season of life has its purpose, just as every plant grows at its own pace.” The subtle green stamp, reading “Everything happens for a reason,” adds an extra layer of meaning and charm. Perfect for kitchens, offices, or creative spaces, this digital print blends vintage aesthetics with a motivational message, making it a delightful addition to any room. What’s Included: • High-Quality Files: SVG, PDF, PNG, and JPEG for versatile printing. • Customizable Sizing: Suitable for various frame sizes. • Instant Download: Start decorating right away. Features: • Combines vintage botanical art with a positive, motivational message. • Perfect for creating a cheerful and uplifting atmosphere. • Versatile for home, office, or as a thoughtful gift. Keywords: Pink strawberry 	https://brandonstewart88.github.io/p/1845235496.html	https://i.etsystatic.com/57004917/r/il/c43089/6619535069/il_fullxfull.6619535069_m96u.jpg	5.99 USD	in stock	new	Home & Garden > Decor > Artwork > Posters, Prints, & Visual Artwork	Stewart Digital Prints
1845218946	Retro Bauhaus Print | Mid-Century Modern Graphic Art | Digital Download	Add a bold touch of retro charm to your space with this Mid-Century Modern Abstract Graphic Design. Featuring vibrant geometric shapes in warm yellows, oranges, and earthy browns, this piece combines a playful 1970s aesthetic with clean, minimalist design. The typography and abstract forms create a timeless and dynamic focal point for your home or office decor. Perfect for fans of retro, modernist, and Scandinavian design, this digital art print can enhance any gallery wall, workspace, or living area. Key Features: • Style: Retro, Mid-Century Modern, and Abstract. • Digital Download: Comes in high-resolution formats (SVG, PDF, PNG, JPEG) for versatile printing. • Versatile Decor: Ideal for living rooms, home offices, or creative spaces. Why You’ll Love It: • Captures the nostalgic essence of 1970s design. • Perfect for adding warmth and personality to your interior. • An affordable and instant way to elevate your wall decor. Keywords: Retro graphic art, mid-century modern print, geomet	https://brandonstewart88.github.io/p/1845218946.html	https://i.etsystatic.com/57004917/r/il/514b79/6571339636/il_fullxfull.6571339636_kjf0.jpg	5.99 USD	in stock	new	Home & Garden > Decor > Artwork > Posters, Prints, & Visual Artwork	Stewart Digital Prints
1844229754	Create Your Calm Print | Minimalist Home Office Decor | Digital Download	Inspire a sense of peace and focus in your space with this “Create Your Calm” Motivational Digital Wall Art Print. Featuring a stylish distressed font and a subtle dotted background, this minimalist design blends seamlessly into modern, boho, or industrial decor styles. Perfect for your home office, living room, bedroom, or meditation corner. This instant download allows you to print the design in your desired size and frame it to create a unique and personal touch in your environment. What’s Included: • SVG File: High-quality and scalable for any size. • PDF File: Ideal for professional-grade printing. • PNG File: 300 DPI for sharp and clear prints. • JPEG File: Universal format, easy to print. Why You’ll Love It: • A meaningful daily reminder to prioritize calm and mindfulness. • Complements minimalist, industrial, or modern decor styles. • Perfect for gift-giving, whether for a housewarming or a loved one’s workspace. How to Use: 1. Download the files instantly after purchase. 2. Pr	https://brandonstewart88.github.io/p/1844229754.html	https://i.etsystatic.com/57004917/r/il/d71f78/6566761330/il_fullxfull.6566761330_61og.jpg	5.99 USD	in stock	new	Home & Garden > Decor > Artwork > Posters, Prints, & Visual Artwork	Stewart Digital Prints
1844200778	Elegant Woman Red Wine Art Print | Vintage Abstract Wall Decor | Digital Download	Add a touch of timeless sophistication to your space with this Vintage-Inspired Modern Art Print, featuring a captivating portrait of an elegant woman enjoying a glass of red wine. This bold, abstract piece is infused with vibrant reds, blacks, and soft muted tones, creating a dramatic and stylish centerpiece for any room. Perfect for dining rooms, lounges, or art-focused spaces, this digital print evokes a mid-century modern charm while remaining contemporary. Its unique blend of minimalism and retro aesthetics makes it an eye-catching addition to modern interiors. What’s Included: • High-quality JPEG file for universal use • PDF format for professional-grade prints • PNG file for clear, crisp printing Why You’ll Love It: • Perfect for creating a chic, retro atmosphere in your home. • Complements mid-century modern, minimalist, and eclectic decor styles. • Instant download lets you print and frame it at your convenience. How to Use: 1. Download the files instantly after purchase. 2. P	https://brandonstewart88.github.io/p/1844200778.html	https://i.etsystatic.com/57004917/r/il/c67e44/6614776897/il_fullxfull.6614776897_p5xa.jpg	5.99 USD	in stock	new	Home & Garden > Decor > Artwork > Posters, Prints, & Visual Artwork	Stewart Digital Prints
1858358851	Japandi Botanical Print | Minimalist Abstract Wall Art | Digital Download	Transform your space with this Japandi Style Minimalist Wall Art—a stunning blend of Japanese simplicity and Scandinavian functionality. This Abstract Botanical Digital Print brings harmony and warmth to any room, making it perfect for living rooms, bedrooms, offices, or meditation spaces. This artwork features a balance of earthy tones, organic shapes, and clean lines, creating a timeless design that complements Japandi, minimalist, and modern interiors. Whether you’re styling your home or gifting a loved one, this piece will bring an air of serenity to any environment. What’s Included: • SVG File (Scalable for all sizes without quality loss) • PDF File (Perfect for high-quality printing) • PNG File (300 DPI, ready for instant use) • JPEG File (High-resolution for various projects) Product Features: • Instant Digital Download: Receive your files immediately after purchase. • Versatile Usage: Ideal for prints, canvas, posters, or digital displays. • High-Quality Format: Designed for pr	https://brandonstewart88.github.io/p/1858358851.html	https://i.etsystatic.com/57004917/r/il/bf31a8/6566479098/il_fullxfull.6566479098_iqsg.jpg	5.99 USD	in stock	new	Home & Garden > Decor > Artwork > Posters, Prints, & Visual Artwork	Stewart Digital Prints
4485446978	Black Family Southern Porch Art | African American Gathering Print (Digital Download)	Step into the warmth of a Southern gathering with this vibrant art print of a Black community coming together on a colorful porch. Teal, yellow, pink, and earthy tones bring this lively scene to life — neighbors catching up, children playing, and stories being shared on a balcony that has seen generations come and go. This piece captures the heart of Black Southern culture: community, togetherness, and the beauty of simply being together. Perfect for living rooms, entryways, dining rooms, or any space that celebrates heritage and hospitality. An ideal Juneteenth gift, housewarming present, or statement piece for anyone who loves Southern culture and Black history. Print at home or at Walgreens, Shutterfly, CVS, or your local print shop. High-resolution JPG supports prints up to 24x36 inches with vivid, gallery-quality detail. No physical item shipped — instant download available immediately after purchase.	https://brandonstewart88.github.io/p/4485446978.html	https://i.etsystatic.com/57004917/r/il/058acb/7895608078/il_fullxfull.7895608078_f1nc.jpg	5.99 USD	in stock	new	Home & Garden > Decor > Artwork > Posters, Prints, & Visual Artwork	Stewart Digital Prints
4485446314	Black Family Kitchen Cooking Art | African American Soul Food Print (Digital Download)	Bring the warmth of a family kitchen to your walls with this colorful art print of a Black family gathered around a soulful home-cooked meal. Rich pinks, greens, and earthy tones capture the love and togetherness of preparing food as a family — a celebration of heritage, tradition, and the joy of sharing a table together. This digital download is perfect for your kitchen, dining room, or any space that celebrates family and culture. The vibrant, contemporary style adds personality and warmth to modern, eclectic, or Afrocentric home decor. A thoughtful gift for Mother&#39;s Day, housewarmings, or anyone who treasures family traditions and soul food memories. After purchase, instantly download your high-resolution files in PNG, JPG, and PDF formats. Print at home, at your local print shop, or through an online printing service. Sizing is flexible — perfect for standard frame sizes from 5x7 to 24x36. No physical item will be shipped.	https://brandonstewart88.github.io/p/4485446314.html	https://i.etsystatic.com/57004917/r/il/702c5f/7943589447/il_fullxfull.7943589447_bbua.jpg	5.99 USD	in stock	new	Home & Garden > Decor > Artwork > Posters, Prints, & Visual Artwork	Stewart Digital Prints
4495653083	Black Hair Salon Wall Art | African American Beauty Shop Print (Digital Download)	A soft, elegant painting of a Black hairstylist at work — standing behind the salon chair in a patterned blouse, tending to her client with care and quiet confidence. Blush pink walls, coral and peach tones, and teal accents create a palette that feels both professional and deeply personal. This is the beauty shop as sacred space. Perfect for working salons, beauty school graduates, bathroom walls, vanity areas, or bedrooms. A meaningful gift for hairstylists, barbers, cosmetologists, or anyone who turned a talent into a chair and a chair into a business. WHAT YOU GET • 1 high-resolution JPG (print up to 24×36 in) • 1 PNG with transparent-ready background • 1 print-ready PDF (8×10 letter-scaled) • Instant digital download — no shipping Print at home or at Walgreens, Shutterfly, CVS, or your local print shop. High-resolution JPG supports prints up to 24x36 inches with vivid, gallery-quality color and detail. No physical item shipped — instant download available immediately after purchas	https://brandonstewart88.github.io/p/4495653083.html	https://i.etsystatic.com/57004917/r/il/9f96a0/7958847882/il_fullxfull.7958847882_p31h.jpg	5.99 USD	in stock	new	Home & Garden > Decor > Artwork > Posters, Prints, & Visual Artwork	Stewart Digital Prints
1861346588	Black Family Beach Art Print | African American Coastal Wall Decor | Digital Download	Celebrate the beauty of family, culture, and togetherness with this stunning digital print, featuring a joyful beach scene filled with warmth, connection, and vibrant summer energy. This contemporary artwork beautifully captures an African American family embracing the waves, sand, and sun, evoking nostalgia and the joy of shared moments by the sea. With bold brushstrokes, rich blue tones, and expressive silhouettes, this coastal-inspired digital painting is the perfect addition to living rooms, bedrooms, offices, or beach homes. Whether you love Black art, coastal decor, or meaningful family imagery, this artwork adds warmth and a personal touch to your space. What’s Included: ✔ High-Resolution Digital Files (JPEG, PNG, PDF, SVG) ✔ Multiple Sizes for Easy Printing ✔ Instant Download – No shipping, print at home or with a professional service Why You’ll Love It: ✨ Culturally Rich & Timeless – A beautiful tribute to Black heritage and family unity. ✨ Perfect Coastal Decor – Adds warmth 	https://brandonstewart88.github.io/p/1861346588.html	https://i.etsystatic.com/57004917/r/il/876d5a/6650638600/il_fullxfull.6650638600_bbfq.jpg	5.99 USD	in stock	new	Home & Garden > Decor > Artwork > Posters, Prints, & Visual Artwork	Stewart Digital Prints
4489117267	Chinoiserie Tiger and Peacocks Wall Art | Vintage Asian Maximalist Print | Digital Download	A regal Chinoiserie-inspired painting of a majestic tiger surrounded by two brilliant peacocks, framed by lush magnolia blossoms, emerald foliage, and golden accents. Rendered in classic jewel tones against a soft pink backdrop, this piece channels traditional Chinese decorative art with a collected, heirloom feel. The kind of statement piece that anchors a gallery wall or becomes the centerpiece of a dining room on its own. Perfect for maximalist interiors, dining rooms, living rooms, entryways, powder rooms, or any space that deserves a dose of drama. A thoughtful housewarming gift, wedding present, or splurge for the collector who appreciates bold, pattern-forward art. WHAT YOU GET • 1 high-resolution JPG (print up to 24×36 in) • 1 PNG with transparent-ready background • 1 print-ready PDF (8×10 letter-scaled) • Instant digital download — no shipping Print at home or at Walgreens, Shutterfly, CVS, or your local print shop. High-resolution JPG supports prints up to 24x36 inches with v	https://brandonstewart88.github.io/p/4489117267.html	https://i.etsystatic.com/57004917/r/il/1bb671/7927740362/il_fullxfull.7927740362_k1mp.jpg	5.99 USD	in stock	new	Home & Garden > Decor > Artwork > Posters, Prints, & Visual Artwork	Stewart Digital Prints
4489127579	Kawaii Smiley Flower Wall Art | Hypebeast Pop Art Print | Y2K Digital Download Maximalist	A bold, joyful pop art flower print bursting with kaleidoscopic Japanese pop art maximalism. Oversized daisies in electric pink, royal blue, fresh white, and emerald green pop against a deep black background — playful, loud, collectable. This is the piece that turns a dorm room into a moment. Perfect for dorm rooms, teen bedrooms, first apartments, lofts, sneaker closets, studios, or anywhere that needs a jolt of Y2K-era color. A standout birthday gift for graduates, streetwear fans, or anyone who grew up on sneaker culture and streetwear drops. WHAT YOU GET • 1 high-resolution JPG (print up to 24×36 in) • 1 PNG with transparent-ready background • 1 print-ready PDF (8×10 letter-scaled) • Instant digital download — no shipping Print at home or at Walgreens, Shutterfly, CVS, or your local print shop. High-resolution JPG supports prints up to 24x36 inches with vivid, gallery-quality color and detail. No physical item shipped — instant download available immediately after purchase.	https://brandonstewart88.github.io/p/4489127579.html	https://i.etsystatic.com/57004917/r/il/5d0061/7927695614/il_fullxfull.7927695614_84wb.jpg	5.99 USD	in stock	new	Home & Garden > Decor > Artwork > Posters, Prints, & Visual Artwork	Stewart Digital Prints
4489120347	Black Woman Tropical Art | African American Lush Greenery Print (Digital Download)	A serene contemporary painting of a Black woman in a yellow-accented dress, seen from behind as she gazes into a lush tropical landscape of palms, wildflowers, and soft coral skies. The palette — peach, teal, gold, and botanical greens — is equal parts peaceful and luxurious. A piece that reads as quiet self-care on canvas. Perfect for bedrooms, bathrooms, sunrooms, meditation corners, or any space that needs a breath of calm. A thoughtful gift for Mother&#39;s Day, self-care milestones, housewarmings, or the woman who finds peace in her own company. WHAT YOU GET • 1 high-resolution JPG (print up to 24×36 in) • 1 PNG with transparent-ready background • 1 print-ready PDF (8×10 letter-scaled) • Instant digital download — no shipping Print at home or at Walgreens, Shutterfly, CVS, or your local print shop. High-resolution JPG supports prints up to 24x36 inches with vivid, gallery-quality color and detail. No physical item shipped — instant download available immediately after purchase.	https://brandonstewart88.github.io/p/4489120347.html	https://i.etsystatic.com/57004917/r/il/cf731e/7975648043/il_fullxfull.7975648043_96w9.jpg	5.99 USD	in stock	new	Home & Garden > Decor > Artwork > Posters, Prints, & Visual Artwork	Stewart Digital Prints
4489139490	Black Wedding Wall Art | African American Bride & Groom Print (Digital Download)	A tender painterly portrait of a Black bride and groom surrounded by a delicate floral backdrop of yellow roses, wildflowers, and botanical greenery. Her veil, tiara, and bouquet; his cream tuxedo and boutonniere — every detail whispers grace, dignity, and forever. The kind of piece that belongs above the bed in a bridal suite. An unforgettable gift for newlyweds, engagement parties, bridal showers, or anniversaries. Also works as the centerpiece of a bedroom, entryway, or any space that honors love and commitment. WHAT YOU GET • 1 high-resolution JPG (print up to 24×36 in) • 1 PNG with transparent-ready background • 1 print-ready PDF (8×10 letter-scaled) • Instant digital download — no shipping Print at home or at Walgreens, Shutterfly, CVS, or your local print shop. High-resolution JPG supports prints up to 24x36 inches with vivid, gallery-quality color and detail. No physical item shipped — instant download available immediately after purchase.	https://brandonstewart88.github.io/p/4489139490.html	https://i.etsystatic.com/57004917/r/il/d862c5/7927684306/il_fullxfull.7927684306_2ndc.jpg	5.99 USD	in stock	new	Home & Garden > Decor > Artwork > Posters, Prints, & Visual Artwork	Stewart Digital Prints
4484142381	Black Couple Record Player Art | African American Music Print (Digital Download)	Turn up the love with this vibrant pop-art style print of a stylish Black couple sitting side by side with their record player. Bold turquoise, sunshine yellow, and cool gray tones create a retro-modern vibe that&#39;s equal parts romantic and iconic. He&#39;s sharp in a suit, she&#39;s radiant in yellow — both lost in the music and each other. This piece is a celebration of Black love, music culture, and timeless style. Ideal for living rooms, bedrooms, music rooms, or any space that needs a bold, colorful focal point. Makes a perfect anniversary gift, housewarming present, or Valentine&#39;s Day surprise for the music-loving couple in your life. Print at home or at any professional print service — Walgreens, Shutterfly, CVS, or your local shop. High-resolution JPG file supports prints up to 24x36 inches with crisp, gallery-quality detail. No physical item shipped — instant download available immediately after purchase.	https://brandonstewart88.github.io/p/4484142381.html	https://i.etsystatic.com/57004917/r/il/34756e/7935507825/il_fullxfull.7935507825_gt8f.jpg	5.99 USD	in stock	new	Home & Garden > Decor > Artwork > Posters, Prints, & Visual Artwork	Stewart Digital Prints
4478368414	Black Couple Garden Tea Date Art | African American Patio Print (Digital Download)	Bring the romance of a garden cafe to your walls with this beautiful art print of a Black couple sharing tea on a lush tropical patio. He sits confidently in a golden orange blazer with an open white shirt, she wears a stunning blue and yellow floral dress, and together they share a quiet, tender moment at a small round table. A teal doorway, hanging white wisteria, potted plants, and cobblestone floors create an intimate, sun-drenched atmosphere full of charm. This contemporary piece radiates warmth, style, and deep connection — perfect for celebrating love in everyday moments. The rich tropical colors and botanical details make it a standout piece for bedrooms, living rooms, entryways, or any space that needs life, beauty, and romance. Print at home or through Walgreens, Shutterfly, CVS, or any professional service. High-resolution JPG supports prints up to 24x36 inches with vibrant color. No physical item shipped — instant download available immediately after purchase.	https://brandonstewart88.github.io/p/4478368414.html	https://i.etsystatic.com/57004917/r/il/975414/7867421752/il_fullxfull.7867421752_rmew.jpg	5.99 USD	in stock	new	Home & Garden > Decor > Artwork > Posters, Prints, & Visual Artwork	Stewart Digital Prints
4484147535	Black Girl Yellow Dress Portrait Art | African American Print (Digital Download)	Make a statement with this striking portrait of a young Black woman in a vibrant yellow dress and blue headband, standing in confident profile against a bold turquoise background. Clean lines, rich color, and quiet strength define this piece — a celebration of Black beauty, personal style, and self-assured grace. This print is perfect for bedrooms, living rooms, dorm rooms, or any space that deserves a bold pop of color and empowerment. It makes an incredible gift for fashion lovers, young women, or anyone who appreciates bold, contemporary Black art. Print at home or at Walgreens, Shutterfly, CVS, or your local print shop. High-resolution JPG supports prints up to 24x36 inches with crisp, gallery-quality color. No physical item shipped — instant download available immediately after purchase.	https://brandonstewart88.github.io/p/4484147535.html	https://i.etsystatic.com/57004917/r/il/953c8c/7887537272/il_fullxfull.7887537272_rebp.jpg	5.99 USD	in stock	new	Home & Garden > Decor > Artwork > Posters, Prints, & Visual Artwork	Stewart Digital Prints
4485451490	Black Woman Blue Portrait Art | African American Wall Art Print (Digital Download)	Make a statement with this striking portrait of a Black woman seated in quiet confidence against a bold blue geometric background. Rich cobalt blues, soft creams, and warm golden accents frame her thoughtful pose — chin resting on her hand, styled in a chic black top and patterned skirt with a gold hair accessory. This piece radiates elegance, strength, and modern sophistication. Perfect for bedrooms, offices, living rooms, or any space that celebrates Black beauty and bold contemporary style. An ideal birthday gift, Galentine&#39;s Day present, or self-love addition to a gallery wall honoring Black women. Print at home or at Walgreens, Shutterfly, CVS, or your local print shop. High-resolution JPG supports prints up to 24x36 inches with vivid, gallery-quality color and detail. No physical item shipped — instant download available immediately after purchase.	https://brandonstewart88.github.io/p/4485451490.html	https://i.etsystatic.com/57004917/r/il/d1468c/7943536383/il_fullxfull.7943536383_ec0e.jpg	5.99 USD	in stock	new	Home & Garden > Decor > Artwork > Posters, Prints, & Visual Artwork	Stewart Digital Prints
4485449262	Black Men Coastal Art | African American Abstract Color Block Print (Digital Download)	Add bold, modern energy to your walls with this striking abstract art print of two Black men standing ankle-deep in color-blocked water against a vivid teal sky. Dressed in golden yellows and soft stripes with straw hats, the silhouetted figures stand still and composed as warm oranges, pinks, and blues ripple beneath them. This piece blends minimalist composition with rich, saturated color — part abstract, part portrait, entirely unforgettable. Perfect for living rooms, offices, bedrooms, or any space that loves bold color and modern art. An ideal gift for Father&#39;s Day, birthdays, or anyone drawn to contemporary African American art with an abstract edge. Print at home or at Walgreens, Shutterfly, CVS, or your local print shop. High-resolution JPG supports prints up to 24x36 inches with vivid, gallery-quality color. No physical item shipped — instant download available immediately after purchase.	https://brandonstewart88.github.io/p/4485449262.html	https://i.etsystatic.com/57004917/r/il/309e19/7895600490/il_fullxfull.7895600490_7o04.jpg	5.99 USD	in stock	new	Home & Garden > Decor > Artwork > Posters, Prints, & Visual Artwork	Stewart Digital Prints
4485444625	Black Cocktail Party Art | African American Social Gathering Print (Digital Download)	Capture the elegance of a Black social gathering with this refined art print of three stylishly dressed figures sharing conversation at a cocktail event. A coral pink backdrop sets the stage as a man in a sleek black shirt and white trousers stands between two women in stunning patterned dresses — one in a colorful patchwork gown, the other in a golden floral print. This piece radiates sophistication, community, and effortless Black style. Perfect for living rooms, dining rooms, entryways, or any space that celebrates elegance and togetherness. An ideal housewarming gift, anniversary present, or gallery wall addition for lovers of contemporary Black art. Print at home or at Walgreens, Shutterfly, CVS, or your local print shop. High-resolution JPG supports prints up to 24x36 inches with vivid, gallery-quality detail. No physical item shipped — instant download available immediately after purchase.	https://brandonstewart88.github.io/p/4485444625.html	https://i.etsystatic.com/57004917/r/il/36d40f/7895586678/il_fullxfull.7895586678_avyg.jpg	5.99 USD	in stock	new	Home & Garden > Decor > Artwork > Posters, Prints, & Visual Artwork	Stewart Digital Prints
